,Authors,Author(s) ID,Title,Year,Source title,Cited by,Affiliations,Authors with affiliations,Abstract,Author Keywords,Index Keywords,References,Abbreviated Source Title,Document Type,Source
1,Dolan E.,57214856246;,"Sexual violence, political apology and competing victimhoods",2020,International Feminist Journal of Politics,NA,"Department of Politics and International Relations, King’s College, University of Aberdeen, United Kingdom","Dolan, E., Department of Politics and International Relations, King’s College, University of Aberdeen, United Kingdom","This article utilizes feminist literature on victimhood and rape mythology to suggest a new theoretical lens by which to view victims of sexual violence and the politics of state recognition through apology. The campaigns of two South Korean victim groups, the comfort women and camptown women, are examined to demonstrate that the process in which they must battle to obtain state redress through apology implies the existence of a discursive, gender-normative regime of victimhood. In this context, this article suggests that although the delivery of an apology for sexual violence might provide some form of gendered justice, this process may produce additional effects which work to discipline the related identities of gender and victimhood, and which have forced the comfort women and camptown women to compete for recognition by the South Korean state. The results of this struggle are ambivalent when it comes to victim agency and, in the cases examined in this article, the politics of apology has resulted in a somewhat impoverished form of redress for sexual violence. © 2019, © 2019 Informa UK Limited, trading as Taylor & Francis Group.",political apology; rape myths; Sexual violence; South Korea; victimhood,NA,"Barkan, E., Karn, A., Group Apology as an Ethical Imperative (2006) Taking Wrongs Seriously: Apologies and Reconciliation, pp. 3-32. , Barkan E., Karn A., (eds), Stanford, CA: Stanford University Press, and,. edited by; Bentley, T., (2016) Empires of Remorse: Narrative, Postcolonialism and Apologies for Colonial Atrocities, , London: Routledge; Brewer, J.D., (2010) Peace Processes: A Sociological Approach, , Cambridge: Polity Press; Brooks, R.L., The Age of Apology (1999) When Sorry Isn’t Enough: The Controversy Over Apologies and Reparations for Human Injustice, pp. 3-12. , Brooks R.L., (ed), New York and London: New York University Press,. edited by; Brownmiller, S., (1975) Against Our Will: Men, Women and Rape, , New York: Bantam Books; Bumiller, K., (2008) In an Abusive State: How Neo-Liberalism Appropriated the Feminist Movement Against Sexual Violence, , Durham, NC: Duke University Press; Buss, D.E., Rethinking ‘Rape as a Weapon of War’ (2009) Feminist Legal Studies, 17, pp. 145-163. , https://doi.org/10.1007/s10691-009-9118-5; Cheng, S., Popularising Purity: Gender, Sexuality and Nationalism in HIV/AIDS Prevention for South Korean Youths (2005) Asia Pacific Viewpoint, 46 (1), pp. 7-20; Cho, G.M., Diaspora of Camptown: The Forgotten War’s Monstrous Family (2006) Women’s Studies Quarterly, 34 (1-2), pp. 309-331; Choe, S., (2009) The New York Times, , https://www.nytimes.com/2009/01/08/world/asia/08korea.html, Ex-Prostitutes Say South Korea and U.S. Enabled Sex Trade Near Bases. Accessed 8 September 2018; Choi, C., Nationalism and Construction of Gender in Korea (1998) Dangerous Women: Gender and Korean Nationalism, pp. 9-32. , Kim E.H., Choi C., (eds), New York: Routledge,. edited by; Christie, N., (1986) From Crime Policy to Victim Policy: Reorienting the Justice System, , The Ideal Victim. edited by E. A. Fattah, 17–30. London: Macmillan Press; Chung, C.S., Korean Women Drafted for Military Sexual Slavery by Japan (1995) True Stories of the Comfort Women, pp. 11-30. , Howard K., (ed), London: Cassell,. edited by; Constable, P., (2015) The Washington Post, , https://www.washingtonpost.com/local/70-years-later-a-korean-comfort-woman-demands-apology-from-japan/2015/04/22/d1cf8794-e7ab-11e4-9767-6276fc9b0ada_story.html?utm_term=.57ae065dc2d7, 70 Years Later, a Korean ‘Comfort Woman’ Demands Apology from Japan. Accessed 12 February 2017; Dudden, A., (2008) Troubled Apologies Among Japan, Korea and the United States, , New York: Columbia University Press; Dudden, A., ‘We Came to Tell the Truth’: Reflections on the Tokyo Women’s Tribunal (2001) Critical Asian Studies, 33 (4), pp. 591-602; Eigenraam, A., (2018) Asia Times, , http://www.atimes.com/article/koreas-patriotic-prostitutes-us-soldiers-get-justice-last/, Korea’s ‘Patriotic Prostitutes’ for US Soldiers get Justice at Last. Accessed 22 May 2018; Enloe, C., (2000) Maneuvers: The International Politics of Militarizing Women's Lives, , Berkeley: University of California Press; Eriksen, T.H., Sex, Violence and Nationalism (2017) Ethnic and Racial Studies, 40 (9), pp. 1438-1449. , https://doi.org/10.1080/01419870.2017.1300293; Gibney, M., Howard-Hassman, R., Coicaud, J.-M., Steiner, N., (2008) The Age of Apology: Facing Up to the Past, , Philadelphia: University of Pennsylvania Press, and, eds; Hein, L., Savage Irony: The Imaginative Power of the ‘Military Comfort Women’ in the 1990s (1999) Gender and History, 11 (2), pp. 336-372. , https://doi.org/10.1111/1468-0424.00145; Herman, E.S., Chomsky, N., (1994) Manufacturing Consent: The Political Economy of the Mass Media, , London: Vintage; Howard, K., (1995) True Stories of the Comfort Women, , London: Cassell, ed; Hyun, E., (2017) The Hankyoreh, , http://english.hani.co.kr/arti/english_edition/e_national/779721.html, Court Awards Damages to Former ‘Comfort Women’ near US Military Bases. Accessed 22 January 2017; Karstedt, S., From Absence to Presence, From Silence to Voice: Victims in International and Transitional Justice Since the Nuremberg Trials (2010) International Review of Victimology, 17, pp. 9-30. , https://doi.org/0269-7580/10; Kim, H.S., History and Memory: The ‘Comfort Women Controversy’ (1997) Positions: East Asia Cultures Critique, 5 (1), pp. 73-108; Kim, S.M., Women, Gender and Social Change in Colonial Korea (2016) Routledge Handbook of Modern Korean History, pp. 141-152. , Seth M.J., (ed), Oxon: Routledge,. edited by; Kim, M.-K., (2018), http://english.hani.co.kr/arti/english_edition/e_international/831625.html, Court Finds that South Korean Government Encouraged Prostitution near US Military Bases. Hankyoreh, Accessed 13 February 2018; Kimura, M., (2016) Unfolding the ‘Comfort Women’ Debates: Modernity, Violence, Women’s Voices, , Basingstoke: Palgrave Macmillan; Kingston, J., (2017) The Japan Times, , http://www.japantimes.co.jp/opinion/2017/03/04/commentary/comfort-women-south-korea-serviced-u-s-forces-seek-justice/#.WM6V5hLyjaY, Comfort Women South Korea who Serviced U.S. Forces Seek Justice. Accessed 4 March 2017; Kirk, G., Okazawa-Rey, M., Demilitarizing Security: Women Oppose U.S. Militarism in East Asia (2001) Frontline Feminisms: Women, War, and Resistance, pp. 157-171. , Waller M., Rycenga J., (eds), New York and London: Routledge, and,. edited by; (1994), http://www.vcn.bc.ca/alpha/learn/comp.htm, Complaint. Accessed 3 September 2018; Lamb, S., Constructing the Victim: Popular Images and Lasting Labels (1999) New Versions of Victims: Feminists Struggle with the Concept, pp. 108-138. , Lamb S., (ed), New York: New York University Press,. edited by; Lee, N.-Y., The Construction of Military Prostitution in South Korea During the U.S. Military Rule, 1945–1948 (2007) Feminist Studies, 33 (3), pp. 453-481; Lee, N.Y., Negotiating the Boundaries of Nation, Christianity, and Gender: the Korean Women's Movement Against Military Prostitution (2011) Asian Journal of Women’s Studies, 17 (1), pp. 34-66. , https://doi.org/10.1080/12259276.2011.11666102; Lee, N.Y., (2014) The Review of Korean Studies, , The Korean Womens Movement of Japanese Military Comfort Women: Navigating between Nationalism and Feminism. 17 (1): 71–92; Lee, N.Y., ‘Un/Forgettable Histories of US Camptown Prostitution in South Korea: Women’s Experiences of Sexual Labor and Government Policies’ (2017) Sexualities, pp. 1-25. , https://doi.org/10.1177/1363460716688683; Lee, J., Kim, J., Lim, H., Rape Myth Acceptance Among Korean College Students: The Roles of Gender, Attitudes Toward Women, and Sexual Double Standard (2010) Journal of Interpersonal Violence, 25 (7), pp. 1200-1223; Lee, J., Lee, C., Lee, W., Attitudes Toward Women, Rape Myths, and Rape Perceptions Among Male Police Officers in South Korea (2012) Psychology of Women Quarterly, 36 (3), pp. 365-376; Lonsway, K.A., Fitzgerald, L.F., Attitudinal Antecedents of Rape Myth Acceptance: A Theoretical and Empirical Reexamination (1995) Journal of Personality and Social Psychology, 68 (4), pp. 704-711; Madlingozi, T., Good Victims, Bad Victims: Apartheid’s Beneficiaries, Victims and the Struggle for Social Justice (2007) Law, Memory and the Legacy of Apartheid, pp. 107-126. , Le Roux W., Van Marle K., (eds), Pretoria: Pretoria University Press,. edited by; Marcus, S., (1992) Feminists Theorize the Political, , Fighting Bodies, Fighting Words: A Theory and Politics of Rape Prevention. edited by J. Butler and J. W. Scott, 385–403. London: Routledge; McEvoy, K., McConnachie, K., Victimology in Transitional Justice: Victimhood, Innocence and Hierarchy (2012) European Journal of Criminology, 9 (5), pp. 527-538. , https://doi.org/10.1177/1477370812454204; Meyers, D.T., Two Victim Paradigms and the Problem of ‘Impure’ Victims (2011) Humanity: An International Journal of Human Rights, Humanitarianism, and Development, 2 (2), pp. 255-275. , https://doi.org/10.1353/hum.2011.0018; (2015), http://www.mofa.go.jp/a_o/na/kr/page4e_000364.html, Announcement by Foreign Ministers of Japan and the Republic of Korea at the Joint Press Occasion. Accessed 29 December 2015; Moon, K.H.S., (1997) Sex among Allies: Military Prostitution in US-Korea Relations, , New York: Columbia University Press; Moon, K.H.S., South Korean Movements Against Militarized Sexual Labor (1999) Asian Survey, 39 (2), pp. 310-327; Moon, K.H.S., Resurrecting Prostitutes and Overturning Treaties: Gender Politics in the ‘Anti-American’ Movement in South Korea (2007) The Journal of Asian Studies, 66 (1), pp. 129-157. , https://doi.org/10.1017/S0021911807000046; Nagel, J., Masculinity and Nationalism: Gender and Sexuality in the Making of Nations (1998) Ethnic and Racial Studies, 21 (2), pp. 242-269. , https://doi.org/10.1080/014198798330007; Nobles, M., (2008) The Politics of Official Apologies, , Cambridge: Cambridge University Press; Osaki, T., (2018) The Japan Times, , https://www.japantimes.co.jp/news/2018/01/12/national/politics-diplomacy/abe-rejects-kangs-new-apology-call-comfort-women-issue/#.Wy0rGKdKiM8, Abe Rejects Seoul’s New Call for Apology on ‘Comfort Women’ Issue. Accessed 28 May 2018; Park, Y.-M., Comforting The Nation: ‘Comfort Women,’ the Politics of Apology and the Workings of Gender (2000) Interventions, 2 (2), pp. 199-211; Petrak, J., Rape: History, Myths, and Reality (2002) The Trauma of Sexual Assault: Treatment, Prevention and Practice, pp. 1-18. , Petrak J., Hedge B., (eds), Chichester: John Wiley and Sons Ltd,. edited by; Randall, M., Sexual Assault Law, Credibility, and ‘Ideal Victims’: Consent, Resistance, and Victim Blaming (2010) Canadian Journal of Women and the Law, 22, pp. 397-433. , https://doi.org/10.3138/cjwl.22.2.397; Ryan, K.M., The Relationship Between Rape Myths and Sexual Scripts: The Social Construction of Rape (2011) Sex Roles, 65, pp. 774-782. , https://doi.org/10.1007/s11199-011-0033-2; Schneider, E.M., Feminism and the False Dichotomy of Victimization and Agency (1993) New York Law School Review, 38, pp. 387-399; Schober, E., Itaewon’s Suspense: Masculinities, Place-Making and the US Armed Forces in a Seoul Entertainment District (2014) Social Anthropology, 22 (1), pp. 36-51; Shim, Y.-H., Feminism and the Discourse of Sexuality in Korea: Continuities and Changes (2001) Human Studies, 24, pp. 133-148; Sjoberg, L., Peet, J.L., Targeting Civillians in War: Feminist Contributions (2011) Feminism and International Relations: Conversations About the Past, Present and Future, pp. 169-187. , Tickner J.A., Sjoberg L., (eds), London and New York: Routledge, and,. edited by; Sjoberg, L., Gentry, C.E., (2007) Mothers, Monsters, Whores: Women's Violence in Global Politics, , London: Zed Books; Smyth, M.B., (2007) Truth Recovery and Justice After Conflict: Managing Violent Pasts, , Oxon: Routledge; Soh, C.S., (1998) The ICAS Lectures, , https://www.icasinc.org/1998/1998l/1998lcss.html, Human Rights and Humanity: the Case of the ‘Comfort Women’. Accessed 28 August 2018; Soh, C.S., (2008) The Comfort Women: Sexual Violence and Postcolonial Memory in Korea and Japan, , Chicago, IL: University of Chicago Press; Suzuki, S., The Competition to Attain Justice for Past Wrongs: The ‘Comfort Women’ Issue in Taiwan (2011) Pacific Affairs, 84 (2), pp. 223-244; Thompson, J., Is Political Apology a Sorry Affair? (2012) Social and Legal Studies, 21 (2), pp. 215-225; Tilly, C., (2008) Credit and Blame, , Princeton, NJ: Princeton University Press; Ueno, C., (2004) Nationalism and Gender, , Melbourne: Trans-Pacific Press; Varga, A., National Bodies: The ‘Comfort Women’ Discourse and its Controversies in South Korea (2009) Studies in Ethnicity and Nationalism, 9 (2), pp. 287-303. , https://doi.org/10.1111/j.1754-9469.2009.01054.x; Vine, D., (2015), http://www.politico.eu/article/my-body-was-not-mine-but-the-u-s-militarys/, ‘My Body was not Mine, but the US Military’s’: Inside the Disturbing Sex Industry Thriving around America’s Bases. Politico, Accessed 11 March 2017; Vine, D., (2015) Base Nation: How U.S. Military Bases Harm America and the World, , New York: Metropolitan Books; Watanabe, K., Trafficking in Women’s Bodies, Then and Now: The Issue of Military ‘Comfort Women’ (1995) Peace and Change, 20 (4), pp. 501-514. , https://doi.org/10.1111/j.1468-0130.1995.tb00249.x; Yuh, J., (2002) Beyond the Shadow of Camptown: Korean Military Brides in America, , New York and London: New York University Press; Yuval-Davis, N., Helm, R., (1997) Gender and Nation, , Thousand Oaks, CA: Sage Publications; Zarakol, A., Ontological (in)Security and State Denial of Historical Crimes: Turkey and Japan (2010) International Relations, 24 (1), pp. 3-23. , https://doi.org/10.1177/0047117809359040; Zimelis, A., Human Rights, the Sex Industry and Foreign Troops: Feminist Analysis of Nationalism in Japan, South Korea and the Philippines (2009) Cooperation and Conflict, 44 (1), pp. 51-71. , https://doi.org/10.1177/0010836708099721",Int. Fem. J. Polit.,Article,Scopus
2,"Ackerly B.A., Friedman E.J., Menon K., Zalewski M., Tabbush C.",8537848200;7403013248;57211993255;16508273500;26421426500;,Editorial,2020,International Feminist Journal of Politics,NA,NA,"Ackerly, B.A.; Friedman, E.J.; Menon, K.; Zalewski, M.; Tabbush, C.",[No abstract available],NA,NA,"Steinmetz, K., (2020), https://time.com/5786710/kimberle-crenshaw-intersectionality/, She Coined the Term ‘Intersectionality’ over 30 Years Ago. Here’s What It Means to Her Today. Time, February 20. Accessed February 26, 2020",Int. Fem. J. Polit.,Editorial,Scopus
3,"de Souza N.M.F., Confortini C.C.",57203400524;37068688500;,Conversations editorial,2020,International Feminist Journal of Politics,NA,"Department of International Relations, Pontifícia Universidade Católica de São Paulo, São Paulo, Brazil; Peace & Justice Studies Program, Wellesley College, Wellesley, MA, United States","de Souza, N.M.F., Department of International Relations, Pontifícia Universidade Católica de São Paulo, São Paulo, Brazil; Confortini, C.C., Peace & Justice Studies Program, Wellesley College, Wellesley, MA, United States",[No abstract available],NA,NA,NA,Int. Fem. J. Polit.,Editorial,Scopus
4,"Abbasi Z., (she/her/hers), Saeidi S., (she/her/hers)",57216390049;36006738700;,The fantastic politics of martyrdom: legacies of war and celestial spaces of women’s empowerment in contemporary Iran,2020,International Feminist Journal of Politics,1,"College of Literature and Humanities, Department of Foreign Languages and Linguistics, Shiraz University, Shiraz, Iran; Department of Political Science, University of Arkansas, Fayetteville, AR, United States","Abbasi, Z., (she/her/hers), College of Literature and Humanities, Department of Foreign Languages and Linguistics, Shiraz University, Shiraz, Iran; Saeidi, S., (she/her/hers), Department of Political Science, University of Arkansas, Fayetteville, AR, United States",[No abstract available],celestial powers; gender; Iran; Martyrdom,NA,"Ali, Z., (2018) Women and Gender in Iraq: Between Nation-Building and Fragmentation, , Cambridge: Cambridge University Press; Denov, M., (2007) Girls in Fighting Forces: Moving Beyond Victimhood, , https://www.gdnonline.org/resources/CIDA_Beyond_forces.pdf, Montreal, QC: CIDA, Accessed January 29, 2020; Elshtain, J.B., (1987) Women and War, , Chicago, IL: University of Chicago Press; Hartman, S., (2019) Wayward Lives, Beautiful Experiments: Intimate Histories of Social Upheaval, , New York: W.W. Norton & Company; Hirst, M.L., Fantasy and Feminism: An Intersectional Approach to Modern Children’s Fantasy Fiction (2018) PhD thesis, , http://ubir.bolton.ac.uk/1968/1/Hirst%20%2C%20Miriam%20Laufey%20Fantasy%20and%20Feminism.pdf, Accessed January 29, 2020; Lewis, A., (1995) Subverting Patriarchy: Feminism and Fantasy in the Works of Irmtraud Morgner, , Oxford: Berg; Molla Hosseini, R., (2018) Yadat Bashad …, , [Remember …], Qom: Kazemi; Moludi, Z., Kera’amat’e Zan dar Didgah’e Magha’am’e Moazzam’e Rahbari (2014) Shamim’e Narjes, 29, pp. 20-24. , [Status of Women the View of the Supreme Leader]; Nemati, H., (2016) Molazemane Haram, , dir.), [The Guardians of the Holy Shrine], Tehran: Ofogh Channel; (2009) “Quran Surah Ali ‘Imran 169 (QS 3: 169) in Arabic and English Translation, , http://www.alquranenglish.com/quran-surah-ali-imran-169-qs-3-169-in-arabic-and-english-translation, Alquran English. July 1. Accessed May 10, 2019; Rafiei, R., (2017) Molazemane Haram, , dir.), [The Guardians of the Holy Shrine], Tehran: Ofogh Channel; Saeidi, S., Creating the Islamic Republic of Iran: Wives and Daughters of Martyrs, and Acts of Citizenship (2010) Citizenship Studies, 14 (2), pp. 113-126; Saeidi, S., Vafa, A., After Isolation: Mirrors between Parallel Worlds and New Conceptual Spaces of Activism in Post-Revolutionary Iran (2019) Millennium: Journal of International Studies, 47 (3), pp. 417-443; Samira, B., (2019), I Wish We Could Have Been as Pious as the Martyrs. WhatsA May 13, 2019; (2018), Moddaiyan’e Namzadi ba Shohada Motevahem’and [Women Who Claim Romantic Engagement with the Martyrs Are Delusional]., December 25; (2018) Sputnik Iran, , https://ir.sputniknews.com/misc/201812254297350-, Namzadi va Ertebat’e Roohi’e Barkhi Dokhtaran’e Basiji’e Irani ba Shohada [Marriage and Emotional Engagement of Some of the Iranian Basiji Women with the Martyrs]., December 25. Accessed May 22, 2019. ارتباط-جنجالی-روحی-با-شهدا/",Int. Fem. J. Polit.,Article,Scopus
